### ISSUE TITLE
macos high sierra sends IPv6 NAs with src IP != advertised IP

### ISSUE THREAD

**Issue by anarkiwi** [faucetsdn/faucet#1139]
When FAUCET NS' an IPv6 address from a new macos client, macos NAs back with a source IP address that does not match the advertised address. FAUCET should use the target/advertised address.

In below example, FAUCET wanted to resolve 2404:138:4011:3e8:e53e:2b19:dc0f:2dc1, and macos advertised 2404:138:4011:3e8:e53e:2b19:dc0f:2dc1 using a source of 2404:138:4011:3e8:1827:e48c:8b6b:41c9.

Frame 1: 198 bytes on wire (1584 bits), 198 bytes captured (1584 bits)
Ethernet II, Src: RealtekU_48:c1:9a (52:54:00:48:c1:9a), Dst: RealtekU_b4:41:df (52:54:00:b4:41:df)
Internet Protocol Version 4, Src: 192.168.122.1, Dst: 192.168.122.2
Transmission Control Protocol, Src Port: 33614, Dst Port: 6653, Seq: 1, Ack: 1, Len: 132
OpenFlow 1.3
    Version: 1.3 (0x04)
    Type: OFPT_PACKET_IN (10)
    Length: 132
    Transaction ID: 0
    Buffer ID: OFP_NO_BUFFER (4294967295)
    Total length: 90
    Reason: OFPR_ACTION (1)
    Table ID: 3
    Cookie: 0x000000005adc15c0
    Match
        Type: OFPMT_OXM (1)
        Length: 12
        OXM field
            Class: OFPXMC_OPENFLOW_BASIC (0x8000)
            0000 000. = Field: OFPXMT_OFB_IN_PORT (0)
            .... ...0 = Has mask: False
            Length: 4
            Value: 4
        Pad: 00000000
    Pad: 0000
    Data
        Ethernet II, Src: Apple_2b:1c:51 (8c:85:90:2b:1c:51), Dst: 0e:00:00:00:00:01 (0e:00:00:00:00:01)
        802.1Q Virtual LAN, PRI: 0, DEI: 0, ID: 250
            000. .... .... .... = Priority: Best Effort (default) (0)
            ...0 .... .... .... = DEI: Ineligible
            .... 0000 1111 1010 = ID: 250
            Type: IPv6 (0x86dd)
        Internet Protocol Version 6, Src: 2404:138:4011:3e8:1827:e48c:8b6b:41c9, Dst: 2404:138:4011:3e8::ffff
            0110 .... = Version: 6
            .... 0000 0000 .... .... .... .... .... = Traffic Class: 0x00 (DSCP: CS0, ECN: Not-ECT)
                .... 0000 00.. .... .... .... .... .... = Differentiated Services Codepoint: Default (0)
                .... .... ..00 .... .... .... .... .... = Explicit Congestion Notification: Not ECN-Capable Transport (0)
            .... .... .... 0000 0000 0000 0000 0000 = Flow Label: 0x00000
            Payload Length: 32
            Next Header: ICMPv6 (58)
            Hop Limit: 255
            Source: 2404:138:4011:3e8:1827:e48c:8b6b:41c9
            Destination: 2404:138:4011:3e8::ffff
            [Source GeoIP: Unknown]
            [Destination GeoIP: Unknown]
        Internet Control Message Protocol v6
            Type: Neighbor Advertisement (136)
            Code: 0
            Checksum: 0xbcef [unverified] [fragmented datagram]
            [Checksum Status: Unverified]
            Flags: 0x60000000, Solicited, Override
                0... .... .... .... .... .... .... .... = Router: Not set
                .1.. .... .... .... .... .... .... .... = Solicited: Set
                ..1. .... .... .... .... .... .... .... = Override: Set
                ...0 0000 0000 0000 0000 0000 0000 0000 = Reserved: 0
            Target Address: 2404:138:4011:3e8:e53e:2b19:dc0f:2dc1
            ICMPv6 Option (Target link-layer address : 8c:85:90:2b:1c:51)
                Type: Target link-layer address (2)
                Length: 1 (8 bytes)
                Link-layer address: Apple_2b:1c:51 (8c:85:90:2b:1c:51)

**Comment by anarkiwi** [comment]
Fixed in https://github.com/faucetsdn/faucet/commit/f15c045c82edfe0746183cdb1f5312b9c9c42a96 and friends.
